tema_id,nombre_tema,n_respuestas,porcentaje,palabras_clave,interpretacion_automatica,ejemplo_1,ejemplo_2,ejemplo_3
0,Tema 0: reserva,8,32.0,"reserva, asistente, información, útil, mejoraría, flujo, resultado, especialmente, alojamiento, flujo reserva","Tema relacionado con el flujo de reserva, confirmación o gestión de reservas. Tema relacionado con la utilidad, claridad o precisión de las respuestas del asistente conversacional.",La experiencia ha sido positiva. El flujo de reserva se entiende bien y el asistente responde rápido. Me ha resultado útil que indique qué datos faltan. Mejoraría un poco el diseño del calendario para que se diferencie todavía más qué días están ocupados y cuáles libres.,"Me ha resultado sencillo reservar. El asistente guía bastante bien y evita tener que buscar manualmente disponibilidad. Me ha gustado que pregunte por confirmación antes de guardar la reserva. Mejoraría la parte de meteorología, mostrando quizá una tabla por días.",El flujo de reserva es claro y rápido. El asistente entiende bien la intención y va directo al punto. Me parece especialmente útil para usuarios que quieren consultar disponibilidad sin llamar o escribir varios mensajes. Mejoraría algunos textos para que sean más cortos.
1,Tema 1: añadiría,7,28.0,"añadiría, respuestas, chat, mejora, útil, gustado, catálogo, respuestas asistente, inicial, asistente","Tema relacionado con la utilidad, claridad o precisión de las respuestas del asistente conversacional.","Me ha gustado la combinación de catálogo visual y chat. Es más cómodo que escribir todo desde cero. Las respuestas del asistente son útiles y no se sienten genéricas. Como mejora, estaría bien incluir más información sobre políticas de cancelación antes de reservar.","La idea me parece útil, aunque en algún momento no sabía exactamente qué formato de fecha usar. El sistema acaba ayudando, pero pondría ejemplos más visibles. Las respuestas son buenas y el diseño está cuidado.","La herramienta es útil, pero al principio me costó entender que podía escribir de forma natural. El asistente responde bien, aunque haría la interfaz un poco más explicativa. Añadiría una guía breve de ejemplos de uso."
2,Tema 2: web,6,24.0,"web, bot, entiende, datos, flujo, fácil, clara, inicio, pedir, principio","Tema relacionado con el flujo de reserva, confirmación o gestión de reservas. Tema relacionado con la utilidad, claridad o precisión de las respuestas del asistente conversacional.","La web me ha parecido muy clara y fácil de usar. Me ha gustado especialmente que se vean los alojamientos desde el inicio y que el bot vaya pidiendo solo los datos necesarios para completar la reserva. Como mejora, añadiría un resumen visual final más destacado antes de confirmar.","La web tiene un diseño agradable y profesional. El flujo general se entiende, aunque al principio no estaba seguro de si tenía que escribir todos los datos juntos o poco a poco. El bot lo aclara bien, pero quizá pondría un ejemplo visible desde el inicio.","La web funciona bien, pero el flujo de reserva podría explicar desde el principio todos los datos que se van a pedir. Me gustó que el asistente no confirme nada sin preguntar antes. La interfaz es bastante limpia."
3,Tema 3: bot,3,12.0,"bot, gustado bot, calendario, reserva, mejoraría, gustado, añadiría, ahorrar, confirmación seguridad, bot guía","Tema relacionado con calendario, fechas y disponibilidad del alojamiento. Tema relacionado con el flujo de reserva, confirmación o gestión de reservas. Tema relacionado con la utilidad, claridad o precisión de las respuestas del asistente conversacional. Tema relacionado con confianza, seguridad o transparencia del proceso.",Muy buena experiencia. Me ha gustado que el bot pueda responder dudas del alojamiento y también hacer la reserva. Parece una herramienta real para ahorrar tiempo al propietario. Añadiría un botón para copiar el resumen de la reserva.,El proceso es muy intuitivo. Me ha gustado que el bot pida los datos que faltan sin obligar a repetir todo. La confirmación final da seguridad. Mejoraría el contraste de algunos elementos del calendario.,El sistema me parece muy cómodo para gestionar una reserva sin intervención manual. El bot guía bien y la web responde rápido. Mejoraría la explicación del calendario y añadiría una leyenda más visible.
-1,Tema -1: respuestas no agrupadas,1,4.0,outliers / respuestas no agrupadas,"Tema relacionado con la utilidad, claridad o precisión de las respuestas del asistente conversacional.","Me ha gustado mucho la parte visual de los apartamentos. Ayuda a decidir antes de hablar con el bot. Las respuestas son útiles y el sistema parece rápido. Como mejora, añadiría filtros visibles por número de personas o precio.",,
